,0,1
0,"$148 Billion Chiplet Market by Processor, Packaging Technology - Global Forecast to 2028","DUBLIN, Feb. 19, 2024 /PRNewswire/ -- The ""Chiplet Market by Processor ( Field-Programmable Gate Array ( FPGA ) , Central Processing Unit ( CPU ) , Graphics Processing Unit ( GPU ) , APU, AI ASIC Co-Processor ) , Packaging Technology ( SiP, FCCSP, FCBGA, 2.5D/3D, WLCSP, Fan-Out ) - Global ..."
1,Sideloading Scandal: Apple's App Store Breach Highlights iPhone Security Fears Apple's App Store Breach Highlights iPhone Security Fears - Apple  ( NASDAQ:AAPL ) ,"In a recent development, a counterfeit cryptocurrency application on Apple Inc.'s AAPL App Store has reportedly duped users out of thousands of dollars. What Happened: A bogus app, masquerading as the Rabby Wallet crypto service, managed to secure approval from the App Store, reported Apple Insider."
2,"Apple Vision Pro 2 Release Date Sooner Than Expected, Insider Claims","Apple's newest product category, Apple Vision Pro, landed just over two weeks ago. But that hasn't stopped speculation from building about when the second-gen model might arrive-and it could be a lot sooner than anyone had expected."
3,"Xi Jinping Government Has More Control On Apple Than Earlier Thought, Report Suggests - Apple  ( NASDAQ:AAPL ) ","Apple Inc.'s AAPL decision to introduce RCS support to iMessage in 2024 is a move that appears to be influenced more by China than Europe, challenging previous assumptions."
4,"$100 Invested In This Stock 20 Years Ago Would Be Worth $45,000 Today - Apple  ( NASDAQ:AAPL ) ","Apple AAPL has outperformed the market over the past 20 years by 28.0% on an annualized basis producing an average annual return of 35.62%. Currently, Apple has a market capitalization of $2.81 trillion."
