,0,1,2
0,"The economy's gone from strength to strength after the pandemic - but no one quite knows why, or what comes next","Economy's gone from pandemic crash to dodging recession, stocks at record high - Business Insider ...",https://www.businessinsider.com/economic-outlook-pandemic-stock-market-crash-inflation-recession-rates-ai-2024-2
1,GAME ON! POWERA TO LAUNCH OFFICIAL LICENSED FORTNITE GAMING ACCESSORIES,PowerA x Fortnite Collection debuts with Peely-themed Nintendo Switch and Midas-themed Xbox Series X|S accessories.,https://www.benzinga.com/pressreleases/24/02/n37205179/game-on-powera-to-launch-official-licensed-fortnite-gaming-accessories
2,Study reveals scammers stole $43.6 million from gaming and metaverse platforms last year,"February 19, 2024 ( Investorideas.com Newswire ) A new analysis reveals cryptocurrency users lost over $43.6 million ( $43,655,107 ) last year after being targeted by scammers on gaming and metaverse platforms.",https://www.investorideas.com/news/2024/cryptocurrency/02194Scammers.asp
3,195 best Presidents Day sales 2024,Want more deals? Visit CNN Underscored's Guide to Presidents Day for wall-to-wall coverage of the best discounts to be found during the holiday weekend. • Allbirds: It's the perfect time to pick up a pair of Tree Runners or Wool Runner-Up Mizzles for yourself or a lucky recipient.,https://www.cnn.com/cnn-underscored/deals/best-presidents-day-sales-2024-02-19
4,How Europe's E-Commerce Innovators Lead Shoppers To The Finish Line,"The retail industry is evolving at an unprecedented speed, driven by an unpredictable economic climate, a proliferation of digital platforms and a paradigm shift from generating sales to elevating customer experience. Granted, budget-conscious shoppers may be more mindful about what they buy.",https://www.forbes.com/sites/peggyannesalz/2024/02/18/how-europes-e-commerce-innovators-lead-shoppers-to-the-finish-line/
